{
  "schema_version": "0.1",
  "client_operation_id": "operation_finish_01",
  "request_digest": "4123456789abcdef0123456789abcdef0123456789abcdef0123456789abcdef",
  "run_id": "run_01",
  "lease_id": "lease_01",
  "terminal_positions": [
    {"source_id": "source_codex", "source_stream_id": "stream_codex_01", "final_source_sequence": 3},
    {"source_id": "source_runtime", "source_stream_id": "stream_runtime_01", "final_source_sequence": 8}
  ],
  "outcome_claim_refs": ["outcome_claim_git_01", "outcome_claim_tests_01"],
  "requested_finalization_deadline_unix_ms": 1783891800000
}
